{
  "implementation": {
    "name": "contextwindowarchitecture-assembler",
    "version": "0.0.1",
    "language": "python"
  },
  "contract": {
    "website_commit": "b7b0d5c523a95e6b8a945a0fd5eaa0168e20335a",
    "dirty": false
  },
  "cases": [
    {
      "id": "admission-reasons",
      "rules": [
        "R-1",
        "R-2",
        "R-3",
        "R-8",
        "R-9",
        "R-10",
        "R-13",
        "R-14",
        "R-15",
        "R-16",
        "R-18",
        "R-21",
        "R-22"
      ],
      "outcome": "passed"
    },
    {
      "id": "admission-route-slots",
      "rules": [
        "R-15",
        "R-21",
        "R-22"
      ],
      "outcome": "passed"
    },
    {
      "id": "blocks-budget",
      "rules": [
        "R-7",
        "R-16",
        "R-21"
      ],
      "outcome": "skipped",
      "detail": "no renderer cwa-message-blocks/v1"
    },
    {
      "id": "blocks-render",
      "rules": [
        "R-7",
        "R-10",
        "R-11",
        "R-21"
      ],
      "outcome": "skipped",
      "detail": "no renderer cwa-message-blocks/v1"
    },
    {
      "id": "budget-droppable-order",
      "rules": [
        "R-16",
        "R-21",
        "R-22"
      ],
      "outcome": "passed"
    },
    {
      "id": "budget-margin",
      "rules": [
        "R-16",
        "R-21"
      ],
      "outcome": "passed"
    },
    {
      "id": "budget-margin-protected",
      "rules": [
        "R-16",
        "R-17",
        "R-21"
      ],
      "outcome": "passed"
    },
    {
      "id": "budget-margin-rounding",
      "rules": [
        "R-16",
        "R-21"
      ],
      "outcome": "passed"
    },
    {
      "id": "budget-omit-after-variants",
      "rules": [
        "R-4",
        "R-12",
        "R-16",
        "R-18",
        "R-21",
        "R-22"
      ],
      "outcome": "passed"
    },
    {
      "id": "budget-protected-variants",
      "rules": [
        "R-16",
        "R-18",
        "R-21"
      ],
      "outcome": "passed"
    },
    {
      "id": "budget-repeated-compress",
      "rules": [
        "R-16",
        "R-18",
        "R-21"
      ],
      "outcome": "passed"
    },
    {
      "id": "budget-route-order",
      "rules": [
        "R-16",
        "R-21"
      ],
      "outcome": "passed"
    },
    {
      "id": "budget-route-tiers",
      "rules": [
        "R-16",
        "R-18",
        "R-21"
      ],
      "outcome": "passed"
    },
    {
      "id": "budget-slot-cap-before-pressure",
      "rules": [
        "R-16",
        "R-18",
        "R-21"
      ],
      "outcome": "passed"
    },
    {
      "id": "budget-slot-caps",
      "rules": [
        "R-3",
        "R-16",
        "R-18",
        "R-21",
        "R-22"
      ],
      "outcome": "passed"
    },
    {
      "id": "budget-slot-floor",
      "rules": [
        "R-16",
        "R-18",
        "R-21"
      ],
      "outcome": "passed"
    },
    {
      "id": "budget-slot-floor-refused",
      "rules": [
        "R-16",
        "R-17",
        "R-21"
      ],
      "outcome": "passed"
    },
    {
      "id": "budget-slot-floor-under-cap",
      "rules": [
        "R-16",
        "R-18",
        "R-21"
      ],
      "outcome": "passed"
    },
    {
      "id": "budget-tier-lowering-ignored",
      "rules": [
        "R-16",
        "R-17",
        "R-21"
      ],
      "outcome": "passed"
    },
    {
      "id": "budget-token-caps",
      "rules": [
        "R-3",
        "R-16",
        "R-18",
        "R-21",
        "R-22"
      ],
      "outcome": "passed"
    },
    {
      "id": "budget-variant-choice",
      "rules": [
        "R-16",
        "R-18",
        "R-21"
      ],
      "outcome": "passed"
    },
    {
      "id": "capability-policy-kind",
      "rules": [
        "R-15",
        "R-21",
        "R-22"
      ],
      "outcome": "passed"
    },
    {
      "id": "conflict-fact",
      "rules": [
        "R-2",
        "R-6",
        "R-11",
        "R-15",
        "R-21"
      ],
      "outcome": "passed"
    },
    {
      "id": "conflict-instruction",
      "rules": [
        "R-3",
        "R-6",
        "R-7",
        "R-11",
        "R-21"
      ],
      "outcome": "passed"
    },
    {
      "id": "conflict-instruction-request-context",
      "rules": [
        "R-6",
        "R-11",
        "R-17",
        "R-21"
      ],
      "outcome": "passed"
    },
    {
      "id": "conflict-refused",
      "rules": [
        "R-6",
        "R-11",
        "R-17",
        "R-21"
      ],
      "outcome": "passed"
    },
    {
      "id": "conflict-request-context",
      "rules": [
        "R-11",
        "R-17",
        "R-21"
      ],
      "outcome": "passed"
    },
    {
      "id": "conflict-required-slot-first",
      "rules": [
        "R-4",
        "R-11",
        "R-17",
        "R-21"
      ],
      "outcome": "passed"
    },
    {
      "id": "conflict-surfaced-shed",
      "rules": [
        "R-11",
        "R-16",
        "R-21"
      ],
      "outcome": "passed"
    },
    {
      "id": "dedupe-evidence-required",
      "rules": [
        "R-12",
        "R-17",
        "R-21",
        "R-24"
      ],
      "outcome": "passed"
    },
    {
      "id": "dedupe-exact",
      "rules": [
        "R-21",
        "R-22",
        "R-24"
      ],
      "outcome": "passed"
    },
    {
      "id": "dedupe-exemptions",
      "rules": [
        "R-6",
        "R-11",
        "R-16",
        "R-21",
        "R-24"
      ],
      "outcome": "passed"
    },
    {
      "id": "dedupe-producer-reported",
      "rules": [
        "R-13",
        "R-21",
        "R-22",
        "R-24"
      ],
      "outcome": "passed"
    },
    {
      "id": "diversity-cap",
      "rules": [
        "R-13",
        "R-15",
        "R-21",
        "R-22",
        "R-24",
        "R-26"
      ],
      "outcome": "passed"
    },
    {
      "id": "diversity-evidence-required",
      "rules": [
        "R-12",
        "R-17",
        "R-21",
        "R-26"
      ],
      "outcome": "passed"
    },
    {
      "id": "diversity-exemptions",
      "rules": [
        "R-6",
        "R-11",
        "R-16",
        "R-21",
        "R-24",
        "R-25",
        "R-26"
      ],
      "outcome": "passed"
    },
    {
      "id": "evidence-cap-omitted",
      "rules": [
        "R-12",
        "R-16",
        "R-17",
        "R-21",
        "R-22"
      ],
      "outcome": "passed"
    },
    {
      "id": "evidence-min-included-items",
      "rules": [
        "R-12",
        "R-17",
        "R-21"
      ],
      "outcome": "passed"
    },
    {
      "id": "evidence-precompute-summary",
      "rules": [
        "R-12",
        "R-16",
        "R-17",
        "R-21",
        "R-22"
      ],
      "outcome": "passed"
    },
    {
      "id": "evidence-request-context",
      "rules": [
        "R-12",
        "R-17",
        "R-21",
        "R-22"
      ],
      "outcome": "passed"
    },
    {
      "id": "evidence-retrieve-narrower",
      "rules": [
        "R-12",
        "R-16",
        "R-17",
        "R-21",
        "R-22"
      ],
      "outcome": "passed"
    },
    {
      "id": "fixture-three-slot",
      "rules": [
        "R-9",
        "R-21",
        "R-22",
        "R-23"
      ],
      "outcome": "passed"
    },
    {
      "id": "history-freshness-order",
      "rules": [
        "R-7"
      ],
      "outcome": "passed"
    },
    {
      "id": "messages-budget",
      "rules": [
        "R-7",
        "R-16",
        "R-21"
      ],
      "outcome": "passed"
    },
    {
      "id": "messages-render",
      "rules": [
        "R-7",
        "R-10",
        "R-11",
        "R-21"
      ],
      "outcome": "passed"
    },
    {
      "id": "messages-repeated-slot",
      "rules": [
        "R-7",
        "R-16",
        "R-18",
        "R-21"
      ],
      "outcome": "passed"
    },
    {
      "id": "ordering-astral-ids",
      "rules": [
        "R-3",
        "R-16",
        "R-21",
        "R-22",
        "R-23"
      ],
      "outcome": "passed"
    },
    {
      "id": "placement-protected-unplaced",
      "rules": [
        "R-16",
        "R-17",
        "R-20",
        "R-21",
        "R-22"
      ],
      "outcome": "passed"
    },
    {
      "id": "placement-required-slot-first",
      "rules": [
        "R-4",
        "R-17",
        "R-20",
        "R-21"
      ],
      "outcome": "passed"
    },
    {
      "id": "placement-unplaced-slot",
      "rules": [
        "R-20",
        "R-21",
        "R-22"
      ],
      "outcome": "passed"
    },
    {
      "id": "protected-over-budget",
      "rules": [
        "R-16",
        "R-17",
        "R-21"
      ],
      "outcome": "passed"
    },
    {
      "id": "protected-over-cap",
      "rules": [
        "R-16",
        "R-17",
        "R-21"
      ],
      "outcome": "passed"
    },
    {
      "id": "protected-over-slot-cap",
      "rules": [
        "R-16",
        "R-17",
        "R-21"
      ],
      "outcome": "passed"
    },
    {
      "id": "render-attribute-escaping",
      "rules": [
        "R-11",
        "R-21"
      ],
      "outcome": "passed"
    },
    {
      "id": "required-instructions-missing",
      "rules": [
        "R-4",
        "R-10",
        "R-17",
        "R-21"
      ],
      "outcome": "passed"
    },
    {
      "id": "required-slot-missing",
      "rules": [
        "R-4",
        "R-17",
        "R-21",
        "R-22"
      ],
      "outcome": "passed"
    },
    {
      "id": "supersede-evidence-required",
      "rules": [
        "R-12",
        "R-17",
        "R-21",
        "R-25"
      ],
      "outcome": "passed"
    },
    {
      "id": "supersede-exemptions",
      "rules": [
        "R-6",
        "R-11",
        "R-16",
        "R-21",
        "R-24",
        "R-25"
      ],
      "outcome": "passed"
    },
    {
      "id": "supersede-observations",
      "rules": [
        "R-2",
        "R-15",
        "R-21",
        "R-22",
        "R-25"
      ],